{
  "$schema": "../schemas/signal-backed-case.schema.json",
  "case_id": "local-discovery-01",
  "site_id": "local-fixture",
  "family_id": "checkout-discovery",
  "kind": "local",
  "entry_url": "http://localhost:4321/",
  "journey_hint": "Exercise the local discovery fixture to confirm the harness loader and grader can validate a deterministic case without relying on a live site.",
  "tags": ["local", "fixture", "checkout", "datalayer"],
  "difficulty": "easy",
  "allowed_actions": ["navigate", "click", "fill"],
  "expected_signals": {
    "tracking_surfaces": ["dataLayer"],
    "event_names_any_of": ["page_view", "view_item", "add_to_cart", "begin_checkout"],
    "event_name_prefixes_any_of": [],
    "event_property_keys_any_of": ["event", "ecommerce"],
    "min_events_total": 2,
    "min_unique_event_names": 1,
    "important_event_names_any_of": ["add_to_cart", "begin_checkout"]
  },
  "negative_signals": {
    "forbidden_event_names": [],
    "forbidden_domains": [],
    "disallowed_url_patterns": []
  },
  "journey_expectations": {
    "target_url_patterns_any_of": ["/cart", "/checkout"],
    "min_navigation_progress_score": 1,
    "must_reach_high_value_state": false
  },
  "budgets": {
    "max_action_steps": 20,
    "max_tool_calls": 80,
    "max_no_progress_actions": 6
  },
  "grader": {
    "type": "heuristic",
    "strictness": "medium"
  },
  "human_baseline_id": null,
  "notes": "Deterministic local guard case for harness loader and grader tests."
}
