{
  "$schema": "../schemas/signal-backed-case.schema.json",
  "case_id": "google-merch-discovery-01",
  "site_id": "google-merch-store",
  "family_id": "checkout-discovery",
  "kind": "live",
  "entry_url": "https://shop.googlemerchandisestore.com/",
  "journey_hint": "Explore the Google Merchandise Store to find product and cart tracking events. Dismiss consent or promo overlays, reach a product detail page, add an item to cart, and try to approach checkout without relying on site-specific memorized selectors.",
  "tags": ["live", "checkout", "datalayer", "retail", "holdout"],
  "difficulty": "medium",
  "allowed_actions": ["navigate", "click", "fill", "dismiss-consent"],
  "expected_signals": {
    "tracking_surfaces": ["dataLayer"],
    "event_names_any_of": ["page_view", "view_item", "select_item", "add_to_cart", "begin_checkout", "purchase"],
    "event_name_prefixes_any_of": [],
    "event_property_keys_any_of": ["event", "ecommerce", "items"],
    "min_events_total": 3,
    "min_unique_event_names": 2,
    "important_event_names_any_of": ["view_item", "add_to_cart", "begin_checkout"]
  },
  "negative_signals": {
    "forbidden_event_names": [],
    "forbidden_domains": [],
    "disallowed_url_patterns": []
  },
  "journey_expectations": {
    "target_url_patterns_any_of": ["/product/", "/cart", "/checkout"],
    "min_navigation_progress_score": 2,
    "must_reach_high_value_state": false
  },
  "budgets": {
    "max_action_steps": 30,
    "max_tool_calls": 120,
    "max_no_progress_actions": 8
  },
  "grader": {
    "type": "heuristic",
    "strictness": "medium"
  },
  "human_baseline_id": null,
  "notes": "Live holdout case for transfer testing against a second retail site."
}
