{
  "$schema": "../schemas/signal-backed-case.schema.json",
  "case_id": "hirmer-stage-purchase-01",
  "site_id": "hirmer-stage",
  "family_id": "checkout-purchase",
  "kind": "live",
  "entry_url": "https://hgg.hirmerstage.de/en",
  "journey_hint": "Dismiss consent, browse to a product, add it to cart, reach checkout, complete the Klarna card payment flow with test payment details, and confirm that a purchase event is observed.",
  "tags": ["live", "stage", "checkout", "purchase", "klarna", "datalayer"],
  "difficulty": "hard",
  "allowed_actions": ["navigate", "click", "fill", "dismiss-consent"],
  "expected_signals": {
    "tracking_surfaces": ["dataLayer"],
    "event_names_any_of": ["page_view", "pageview", "view_item", "productView", "add_to_cart", "addToCart", "begin_checkout", "checkout", "purchase"],
    "event_name_prefixes_any_of": [],
    "event_property_keys_any_of": ["event", "ecommerce"],
    "min_events_total": 4,
    "min_unique_event_names": 3,
    "important_event_names_any_of": ["purchase"]
  },
  "negative_signals": {
    "forbidden_event_names": [],
    "forbidden_domains": [],
    "disallowed_url_patterns": []
  },
  "journey_expectations": {
    "target_url_patterns_any_of": ["/checkout", "/payment", "/order", "/success", "/confirmation"],
    "min_navigation_progress_score": 3,
    "must_reach_high_value_state": true
  },
  "budgets": {
    "max_action_steps": 50,
    "max_tool_calls": 180,
    "max_no_progress_actions": 10
  },
  "grader": {
    "type": "heuristic",
    "strictness": "high"
  },
  "human_baseline_id": null,
  "notes": "Live stage benchmark with purchase as the mandatory success signal."
}
